,ApplID,Report_ID,answer,question
0,D030834,http://ciwqs.waterboards.ca.gov/ciwqs/ewrims_online_reporting/viewReport.do?formId=372093,No,a. Required to measure as of the date this report is submitted
1,D030952,http://ciwqs.waterboards.ca.gov/ciwqs/ewrims_online_reporting/viewReport.do?formId=323549,Yes,b. Is diversion measured?
2,D032404,http://ciwqs.waterboards.ca.gov/ciwqs/ewrims_online_reporting/viewReport.do?formId=372018,,c. An alternative compliance plan was submitted to the division of water rights on
3,A028597,http://ciwqs.waterboards.ca.gov/ciwqs/ewrims_online_reporting/viewReport.do?formId=333798,05/18/2015,d. A request for additional time was submitted to the division of water rights on
4,A031231,http://ciwqs.waterboards.ca.gov/ciwqs/ewrims_online_reporting/viewReport.do?formId=293971,06/01/2015, 
